{
  "$schema": "https://json-schema.org/draft/2020-12/schema",
  "$id": "https://chiragagg5k.github.io/mcp-event-subscriptions/schemas/subscription-v1.schema.json",
  "title": "Experimental MCP event subscription record v1",
  "type": "object",
  "properties": {
    "version": {
      "type": "integer",
      "const": 1
    },
    "id": {
      "type": "string",
      "minLength": 1
    },
    "principal": {
      "type": "string",
      "minLength": 1
    },
    "event": {
      "type": "object",
      "properties": {
        "name": {
          "type": "string",
          "minLength": 1
        },
        "arguments": {
          "type": "object"
        }
      },
      "required": [
        "name",
        "arguments"
      ],
      "additionalProperties": false
    },
    "delivery": {
      "oneOf": [
        {
          "type": "object",
          "properties": {
            "mode": {
              "const": "webhook"
            },
            "url": {
              "type": "string",
              "format": "uri",
              "pattern": "^https://"
            },
            "secret": {
              "type": "string",
              "pattern": "^whsec_[A-Za-z0-9+/]+={0,2}$"
            }
          },
          "required": [
            "mode",
            "url",
            "secret"
          ],
          "additionalProperties": false
        },
        {
          "type": "object",
          "properties": {
            "mode": {
              "const": "push"
            }
          },
          "required": [
            "mode"
          ],
          "additionalProperties": false
        }
      ]
    },
    "lease": {
      "type": "object",
      "properties": {
        "expiresAt": {
          "type": [
            "string",
            "null"
          ],
          "format": "date-time",
          "pattern": "^\\d{4}-\\d{2}-\\d{2}T\\d{2}:\\d{2}:\\d{2}(?:\\.\\d{1,6})?Z$"
        },
        "refreshBefore": {
          "type": [
            "string",
            "null"
          ],
          "format": "date-time",
          "pattern": "^\\d{4}-\\d{2}-\\d{2}T\\d{2}:\\d{2}:\\d{2}(?:\\.\\d{1,6})?Z$"
        }
      },
      "required": [
        "expiresAt",
        "refreshBefore"
      ],
      "additionalProperties": false
    },
    "extensions": {
      "type": "object",
      "propertyNames": {
        "pattern": "^[a-z][a-z0-9-]*(?:\\.[a-z][a-z0-9-]*){2,}$"
      }
    }
  },
  "required": [
    "version",
    "id",
    "principal",
    "event",
    "delivery",
    "lease"
  ],
  "additionalProperties": false
}
